{
  "$schema": "http://json-schema.org/draft-07/schema#",
  "title": "WoR-Flasher Configuration Schema",
  "description": "Shared JSON configuration for the native Rust domain, Clap CLI and Dioxus desktop, with compatibility for previously saved settings. Appearance is stored separately; native physical-write permission requires independent command-line or GUI consent.",
  "type": "object",
  "properties": {
    "$schema": {
      "type": "string"
    },
    "target": {
      "type": "object",
      "properties": {
        "board": {
          "type": "string",
          "enum": ["pi2-v1.1", "pi2-v1.2", "pi3-b"],
          "description": "Explicit physical board required by the legacy ARM32 IoT Core FFU profile. The IoT workflow resolves its own route; rpiModel is for desktop package selection."
        },
        "rpiModel": {
          "type": "integer",
          "enum": [3, 4, 5],
          "description": "Target package route: 3 (Pi 3 or Pi 2 v1.2), 4, or 5. The GUI lists Pi 2 v1.2 separately."
        },
        "device": {
          "type": "string",
          "description": "Target block device path (e.g. /dev/sda or /dev/disk4)"
        },
        "canInstallOnSameDrive": {
          "type": "boolean",
          "description": "Whether to install Windows directly onto target drive (true) or build recovery media (false)"
        }
      },
      "additionalProperties": false
    },
    "media": {
      "type": "object",
      "properties": {
        "imageFamily": {
          "type": "string",
          "enum": ["desktop", "iot-core"],
          "description": "Desktop ARM64 ISO/ESD preparation (default) or separate legacy ARM32 IoT Core full-FFU deployment."
        },
        "architecture": {
          "type": "string",
          "enum": ["arm64", "arm32"],
          "description": "Optional architecture assertion: desktop requires arm64; the supported Raspberry Pi IoT Core profile requires arm32. Omit to use the image-family architecture."
        },
        "downloadIotImage": {
          "type": "boolean",
          "default": false,
          "description": "Explicitly download and import the reviewed Microsoft IoT Core package with mandatory TLS/hash checks. Only for imageFamily=iot-core; leave sourceFile empty. No Windows installer is executed."
        },
        "winLang": {
          "type": "string",
          "description": "Windows language code (e.g. en-us)"
        },
        "bid": {
          "type": "string",
          "description": "Windows build ID (e.g. 22631.2861)"
        },
        "sourceFile": {
          "type": "string",
          "description": "Local desktop Windows ARM64 ISO/ESD, or the reviewed Raspberry Pi IoT Core FFU/ISO/MSI. IoT delivery packages are verified and extracted natively. Raw IMG, unapproved images and ARM64 IoT Core are not accepted."
        },
        "downloadDir": {
          "type": "string",
          "description": "Directory path for downloads and extracted media"
        },
        "useCache": {
          "type": "integer",
          "enum": [0, 1, 2],
          "description": "Cache mode: 0 (redownload), 1 (reuse with manifest check), 2 (trust cache)"
        }
      },
      "additionalProperties": false
    },
    "customization": {
      "type": "object",
      "properties": {
        "applyCustomConfigTxt": {
          "type": "boolean",
          "description": "Whether to apply custom config.txt to the boot partition"
        },
        "configTxt": {
          "type": "string",
          "description": "Body of config.txt for the boot partition. Validated and normalized before flashing; required UEFI boot entries cannot be overridden."
        },
        "bootSettings": {
          "type": "object",
          "description": "Structured desktop boot settings, using the same controls/validation as Boot Config Editor. Only settings applicable to the selected model/current config are accepted; required bootloader and memory settings are protected.",
          "properties": {
            "disable_overscan": { "type": "boolean" },
            "enable_uart": { "type": "boolean" },
            "uart_2ndstage": { "type": "boolean" },
            "arm_boost": { "type": "boolean" },
            "usb_max_current_enable": { "type": "boolean" },
            "force_turbo": { "type": "boolean" },
            "core_freq": { "type": ["integer", "null"], "minimum": 0 },
            "hdmi_force_hotplug": { "type": "boolean" },
            "hdmi_group": { "type": ["integer", "null"], "minimum": 0, "maximum": 2 },
            "hdmi_mode": { "type": ["integer", "null"], "minimum": 0, "maximum": 107 },
            "hdmi_drive": { "type": ["integer", "null"], "minimum": 1, "maximum": 2 }
          },
          "additionalProperties": false
        },
        "hdmiMode": {
          "type": "string",
          "enum": ["official", "recommended", "custom"],
          "description": "Desktop HDMI display override written into config.txt: official image default, this Pi model's established override when one exists (Pi 4 only today), or custom settings (validated and normalized, preserving user additions). Unset follows the selected Pi model's default."
        },
        "iotHdmiMode": {
          "type": "string",
          "enum": ["official", "720p60", "1080p60", "custom"],
          "default": "720p60",
          "description": "IoT-only firmware display timing: recommended 720p60 compatibility (default), unchanged official image, 1080p60, or restricted custom HDMI settings. Explicit selections are preserved. Monitor and OS-driver support still apply."
        },
        "iotHdmiConfig": {
          "type": "string",
          "maxLength": 512,
          "default": "",
          "description": "For iotHdmiMode=custom, ASCII HDMI key=value lines. Require hdmi_group and hdmi_mode; optionally hdmi_force_hotplug and hdmi_drive. Other firmware keys, filters and custom modelines are rejected."
        },
        "oobeNetworkBypass": {
          "type": "boolean",
          "description": "Whether to hide Windows 11 OOBE network and online-account screens. Ignored for Windows 10."
        },
        "pi4AutoDisable3Gb": {
          "type": "boolean",
          "description": "Whether to disable 3GB RAM limit on Pi 4 after setup"
        },
        "pi4UefiShellUnlock": {
          "type": "boolean",
          "description": "Whether to use a one-time UEFI Shell handoff to persistently disable the Pi 4 RAM limit"
        },
        "uefiUseLatest": {
          "type": "boolean",
          "description": "Override UEFI selection: true uses the latest stable release, false uses the selected/configured UEFI version. Omit to use latest for Pi 3 and pinned for Pi 4/5."
        },
        "driversUseLatest": {
          "type": "boolean",
          "description": "Whether to query GitHub for latest drivers instead of the selected/configured driver version"
        },
        "hideEmptyDrives": {
          "type": "boolean",
          "description": "Whether to hide empty card-reader slots in WoR-PE"
        }
      },
      "additionalProperties": false
    },
    "userAccount": {
      "type": "object",
      "properties": {
        "iotCore": {
          "type": "object",
          "properties": {
            "enabled": {
              "type": "boolean",
              "default": false,
              "description": "Offer separate administrator rename/password setup after IoT first boot using fingerprint-pinned SSH; no offline FFU account modification."
            },
            "username": {
              "type": "string",
              "default": "Administrator",
              "pattern": "^[A-Za-z0-9][A-Za-z0-9_.-]{0,19}$",
              "description": "Desired name for the existing built-in IoT administrator; service/system accounts are excluded."
            },
            "password": {
              "type": "string",
              "default": "",
              "description": "New IoT password (12-127 UTF-16 characters), used only by the GUI post-boot SSH step. Prefer the masked GUI field; configuration files store plaintext and must not be committed."
            },
            "host": {
              "type": "string",
              "maxLength": 253,
              "default": "",
              "description": "Pi local IP address or hostname for manual post-boot connection. Required when automaticAddress is false; retained but unused while automatic addressing is enabled. Editing never resolves or connects."
            },
            "automaticAddress": {
              "type": "boolean",
              "description": "Resolve the default IoT hostname minwinpc after Connect (recommended). Defaults to true when no host is specified; an existing explicit host defaults to manual. Does not configure DHCP or assign a static address."
            },
            "currentUsername": {
              "type": "string",
              "minLength": 1,
              "maxLength": 20,
              "pattern": "^[A-Za-z0-9][A-Za-z0-9_.-]{0,19}$",
              "description": "Required current IoT administrator login, prefilled with the Microsoft factory username when unset. Cannot be blank or disabled by turning off personalization; separate from the desired new administrator name."
            },
            "currentPassword": {
              "type": "string",
              "minLength": 1,
              "maxLength": 127,
              "description": "Required current IoT login password, prefilled with the Microsoft factory password when unset. Empty passwords are unsupported by the password-based IoT SSH flow. Prefer the masked Advanced Options field; configuration files store plaintext and must remain private."
            },
            "languageSetup": {
              "type": "boolean",
              "default": true,
              "description": "Apply the selected IoT UI language under DefaultAccount during post-boot SSH personalization, verifying that the language is installed and reporting restart requirements."
            },
            "language": {
              "type": "string",
              "default": "",
              "description": "IoT language tag. Empty inherits the shared host-language detection or desktop locale preference; explicit selections are preserved. No language pack is downloaded."
            }
          },
          "additionalProperties": false
        },
        "setupAccount": {
          "type": "boolean",
          "description": "Whether to setup a local administrator account during setup"
        },
        "username": {
          "type": "string",
          "description": "Username for optional local account"
        },
        "password": {
          "type": "string",
          "description": "Password for optional local account (omit or leave empty in committed configs)"
        },
        "localeSetup": {
          "type": "boolean",
          "description": "Whether to configure Windows locale and regional settings (enabled by default)"
        },
        "locale": {
          "type": "string",
          "description": "Windows locale code (e.g. en-US or en-GB); leave empty to use the host locale or en-US"
        }
      },
      "additionalProperties": false
    },
    "execution": {
      "type": "object",
      "properties": {
        "confirmIotErase": {
          "type": "boolean",
          "default": false,
          "description": "Explicit erase consent for non-interactive IoT Core deployment only. Ignored for inspection-only dry runs. Requires an explicitly selected safe whole disk."
        },
        "wipeIotDrive": {
          "type": "boolean",
          "default": false,
          "description": "Zero and read-back every addressable sector of the selected safe drive before applying the verified IoT FFU. Slow, destructive and opt-in; requires confirmIotWipe plus normal erase consent. Not a secure erase or hardware repair."
        },
        "confirmIotWipe": {
          "type": "boolean",
          "default": false,
          "description": "Separate explicit confirmation for a requested full-drive IoT wipe. GUI users confirm Wipe and Flash; automation must deliberately opt in. Dry runs never wipe."
        },
        "dryRun": {
          "type": "boolean",
          "description": "Whether to run in dry-run mode without writing to storage"
        },
        "skipImageVerification": {
          "type": "boolean",
          "description": "Whether to skip post-flash verification"
        },
        "verifyTls": {
          "type": "boolean",
          "description": "Whether to verify TLS certificates during downloads"
        },
        "checkForUpdates": {
          "type": "boolean",
          "description": "Whether to report a newer published release before setup work starts. The check is read-only and never modifies this installation."
        },
        "noUpdate": {
          "type": "boolean",
          "description": "Legacy inverse of checkForUpdates; true disables the release check"
        },
        "logFile": {
          "type": "string",
          "description": "Optional custom path for installer output. Omit to use a timestamped log under the download directory's logs/ folder, with last-run.log refreshed for support."
        }
      },
      "additionalProperties": false
    },
    "notifications": {
      "type": "object",
      "description": "How the GUI announces the end of a flash. Only the completion sound is selectable; a failure always uses the platform's own error sound.",
      "properties": {
        "playSound": {
          "type": "boolean",
          "description": "Whether to play a sound when the flash finishes"
        },
        "showNotification": {
          "type": "boolean",
          "description": "Whether to post a desktop notification when the flash finishes (macOS Notification Center, or notify-send on Linux)"
        },
        "sounds": {
          "type": "object",
          "description": "Completion sound per host platform. A name this host cannot play falls back to the platform default.",
          "properties": {
            "macos": {
              "type": "string",
              "description": "Name of a sound in /System/Library/Sounds (e.g. Glass, Hero, Ping, Submarine)"
            },
            "linux": {
              "type": "string",
              "description": "freedesktop sound-theme event name (e.g. complete, bell, message)"
            },
            "windows": {
              "type": "string",
              "description": "Reserved: Windows is not a supported host, so no sound is played there"
            }
          },
          "allOf": [
            {
              "if": {
                "required": ["media"],
                "properties": {
                  "media": {
                    "required": ["imageFamily"],
                    "properties": { "imageFamily": { "const": "iot-core" } }
                  }
                }
              },
              "then": {
                "required": ["target"],
                "properties": {
                  "target": {
                    "required": ["board"],
                    "properties": { "canInstallOnSameDrive": { "const": true } }
                  },
                  "media": { "properties": { "architecture": { "const": "arm32" } } },
                  "execution": { "properties": { "skipImageVerification": { "const": false } } }
                }
              },
              "else": {
                "properties": {
                  "media": { "properties": { "architecture": { "const": "arm64" }, "downloadIotImage": { "const": false } } }
                }
              }
            }
          ],
          "additionalProperties": false
        }
      },
      "additionalProperties": false
    },
    "system": {
      "type": "object",
      "description": "Advanced overrides for project runtime metadata. Defaults live in src/config/metadata.json and are loaded by src/lib/metadata.sh; ordinary configs should usually omit this block.",
      "properties": {
        "peInstallerUrl": {
          "type": "string",
          "description": "Download URL for WoR-PE installer package"
        },
        "peInstallerSha256": {
          "type": "string",
          "description": "SHA-256 digest for WoR-PE installer package"
        },
        "uefiVerPi3": {
          "type": "string",
          "description": "Selected Pi 3 UEFI tag, used when uefiUseLatest is false and as the latest-lookup fallback; Pi 3 defaults to latest stable"
        },
        "uefiVerPi4": {
          "type": "string",
          "description": "Selected Pi 4 UEFI tag, used when latest is disabled and as the latest-lookup fallback"
        },
        "uefiVerPi5": {
          "type": "string",
          "description": "Selected Pi 5 UEFI tag, used when latest is disabled and as the latest-lookup fallback"
        },
        "driverVer": {
          "type": "string",
          "description": "Selected Windows driver release tag, used when latest is disabled and as the latest-lookup fallback"
        },
        "armv80MaxBuild": {
          "type": "integer",
          "description": "Maximum Windows build supported on ARMv8.0 hardware"
        },
        "win11MinBuild": {
          "type": "integer",
          "description": "Minimum build ID for Windows 11"
        },
        "win10OldestBuild": {
          "type": "string",
          "description": "Oldest supported Windows 10 build ID"
        },
        "exampleBid": {
          "type": "string",
          "description": "Example build ID shown in prompts"
        },
        "armv80SafeBid": {
          "type": "string",
          "description": "Recommended safe build ID for ARMv8.0 hardware"
        },
        "repoSlug": {
          "type": "string",
          "description": "GitHub repository owner/repo slug checked for newer releases"
        }
      },
      "additionalProperties": false
    }
  },
  "additionalProperties": false
}
